{
  "$schema": "https://json-schema.org/draft/2020-12/schema",
  "$id": "https://schemas.nad.robrolabs.com/module/release-metadata.v1.schema.json",
  "title": "ModuleReleaseMetadataDocument",
  "type": "object",
  "additionalProperties": false,
  "required": ["schemaVersion", "releasedAt", "sourceDirectory", "license", "changelog", "hotUpdate"],
  "properties": {
    "schemaVersion": { "const": 1 },
    "releasedAt": { "type": "string", "pattern": "^\\d{4}-\\d{2}-\\d{2}$" },
    "sourceRevision": { "type": ["string", "null"], "minLength": 1, "maxLength": 200 },
    "sourceDirectory": { "type": "string", "minLength": 1, "maxLength": 200 },
    "license": { "type": "string", "minLength": 1, "maxLength": 120 },
    "repositoryUrl": { "type": ["string", "null"], "maxLength": 500 },
    "sourceUrl": { "type": ["string", "null"], "maxLength": 500 },
    "sourceTag": { "type": ["string", "null"], "minLength": 1, "maxLength": 200 },
    "changelog": {
      "type": "object",
      "additionalProperties": false,
      "required": ["summary", "entries"],
      "properties": {
        "summary": { "type": "string", "minLength": 1, "maxLength": 500 },
        "entries": { "type": "array", "minItems": 1, "maxItems": 12, "uniqueItems": true, "items": { "type": "string", "minLength": 1, "maxLength": 300 } }
      }
    },
    "hotUpdate": {
      "type": "object",
      "additionalProperties": false,
      "required": ["compatibility", "preserves"],
      "properties": {
        "compatibility": { "const": "compatible" },
        "preserves": { "type": "array", "minItems": 1, "maxItems": 16, "uniqueItems": true, "items": { "type": "string", "minLength": 1, "maxLength": 200 } }
      }
    }
  }
}
